{"current":"sha256:93147e2120d582a8ad2fe0f5ed4f12478350f4c4149c432391d78d386e9e7679","last_verified":"sha256:93147e2120d582a8ad2fe0f5ed4f12478350f4c4149c432391d78d386e9e7679","schema_version":2,"snapshots":{"sha256:93147e2120d582a8ad2fe0f5ed4f12478350f4c4149c432391d78d386e9e7679":{"agent_runs":[{"adapter":"omp","adapter_version":"18.2.8","argv_template":["-p","--cwd","<workspace>","--no-session","--no-rules","--no-skills","--no-extensions","--no-lsp","--no-pty","--no-title","--tools","read,grep,glob,edit,write","--approval-mode","yolo","--max-time","<seconds>s","--config","<overlay>","@<prompt-file>"],"duration_ms":43018,"environment_names":["HOME","PATH","PI_CODING_AGENT_DIR","PYTHONDONTWRITEBYTECODE","TMPDIR"],"executable":"/home/arthur/.bun/install/global/node_modules/@oh-my-pi/pi-coding-agent/dist/cli.js","executable_hash":"sha256:83f86ae06b989237c5d7ea8cf690eb2e2a97e1e4a54fddb02e0fd3b00845a92c","implementation_hash":"sha256:a289c262613612a44e742f4246c93d2970ad685702d4f1302921a5db9550982b","prompt_hash":"sha256:2128d0d204d244a3a8967ebf0ad0531669276ec63068cf28bb61426291722055","status":{"cancelled":false,"exit_code":0,"signal":null,"timed_out":false},"stderr":{"bytes":11,"sha256":"sha256:dfef4c342f986ab93a9e0bb90f2d88c3bf25b2455853253d31ef95c1c55192a7","truncated":false},"stdout":{"bytes":197,"sha256":"sha256:b88399ca9f31ad5ecf9251c2206c2cb7921e258c98c94dfebd4ded2a58a2fd0f","truncated":false},"symbol":"curriculum.stock_record.value_record"},{"adapter":"omp","adapter_version":"18.2.11","argv_template":["-p","--cwd","<workspace>","--no-session","--no-rules","--no-skills","--no-extensions","--no-lsp","--no-pty","--no-title","--tools","read,grep,glob,edit,write","--approval-mode","yolo","--max-time","<seconds>s","--config","<overlay>","@<prompt-file>"],"duration_ms":28604,"environment_names":["HOME","PATH","PI_CODING_AGENT_DIR","PYTHONDONTWRITEBYTECODE","TMPDIR"],"executable":"/home/arthur/.bun/install/global/node_modules/@oh-my-pi/pi-coding-agent/dist/cli.js","executable_hash":"sha256:ce797fb3ed92e768c8c8f0f852bcc3150d8ed4b4e9a8eaab897694ae54b0d3de","implementation_hash":"sha256:a289c262613612a44e742f4246c93d2970ad685702d4f1302921a5db9550982b","prompt_hash":"sha256:a793bfc9161391f94754199bfb4a46596f3e0b253d2f21e8c0804b3da5c6b9e4","status":{"cancelled":false,"exit_code":0,"signal":null,"timed_out":false},"stderr":{"bytes":11,"sha256":"sha256:dfef4c342f986ab93a9e0bb90f2d88c3bf25b2455853253d31ef95c1c55192a7","truncated":false},"stdout":{"bytes":1237,"sha256":"sha256:4c01671f23548b6b6851199f6ef450e8393693cfff94d5dbdadca019b7dc001d","truncated":false},"symbol":"curriculum.stock_record.value_record"},{"adapter":"omp","adapter_version":"18.2.11","argv_template":["-p","--cwd","<workspace>","--no-session","--no-rules","--no-skills","--no-extensions","--no-lsp","--no-pty","--no-title","--tools","read,grep,glob,edit,write","--approval-mode","yolo","--max-time","<seconds>s","--config","<overlay>","@<prompt-file>"],"duration_ms":34794,"environment_names":["HOME","PATH","PI_CODING_AGENT_DIR","PYTHONDONTWRITEBYTECODE","TMPDIR"],"executable":"/home/arthur/.bun/install/global/node_modules/@oh-my-pi/pi-coding-agent/dist/cli.js","executable_hash":"sha256:ce797fb3ed92e768c8c8f0f852bcc3150d8ed4b4e9a8eaab897694ae54b0d3de","implementation_hash":"sha256:a289c262613612a44e742f4246c93d2970ad685702d4f1302921a5db9550982b","prompt_hash":"sha256:bfaa0d3ae579c0ab661a1331002e317d8523263cffc28a535eebdc8b09953fdd","status":{"cancelled":false,"exit_code":0,"signal":null,"timed_out":false},"stderr":{"bytes":11,"sha256":"sha256:dfef4c342f986ab93a9e0bb90f2d88c3bf25b2455853253d31ef95c1c55192a7","truncated":false},"stdout":{"bytes":1080,"sha256":"sha256:e416e395b871fb4491006d03d8ebbfb14d623f012ae36befe194b6f2dd651a61","truncated":false},"symbol":"curriculum.stock_record.value_record"},{"adapter":"omp","adapter_version":"18.2.11","argv_template":["-p","--cwd","<workspace>","--no-session","--no-rules","--no-skills","--no-extensions","--no-lsp","--no-pty","--no-title","--tools","read,grep,glob,edit,write","--approval-mode","yolo","--max-time","<seconds>s","--config","<overlay>","@<prompt-file>"],"duration_ms":94119,"environment_names":["HOME","PATH","PI_CODING_AGENT_DIR","PYTHONDONTWRITEBYTECODE","TMPDIR"],"executable":"/home/arthur/.bun/install/global/node_modules/@oh-my-pi/pi-coding-agent/dist/cli.js","executable_hash":"sha256:ce797fb3ed92e768c8c8f0f852bcc3150d8ed4b4e9a8eaab897694ae54b0d3de","implementation_hash":"sha256:8b745d50d085076bae2bb0cf7f24f7b1d7781fc7627f6b0c9d8ae46d25c25850","prompt_hash":"sha256:97fa367da6f9e64a034ed579efd320d1caf8e2ca2ee064994575d165b75513d2","status":{"cancelled":false,"exit_code":0,"signal":null,"timed_out":false},"stderr":{"bytes":11,"sha256":"sha256:dfef4c342f986ab93a9e0bb90f2d88c3bf25b2455853253d31ef95c1c55192a7","truncated":false},"stdout":{"bytes":1117,"sha256":"sha256:96520c22da33587dcd8a75ff4d353f5d75fbdff9422e1dc7e92bc2b8c14d3268","truncated":false},"symbol":"curriculum.stock_record.value_stock_record"}],"canonical_ir_schema":9,"compiler_version":"1.0.0","contract_surface":{"curriculum.stock_record":{"declarations":[{"annotations":[],"doc":null,"generics":[],"kind":"const","name":"curriculum.stock_record.MAX_F64","public":true,"type":{"kind":"primitive","name":"f64"},"value":{"bits":"7fefffffffffffff","kind":"f64"}},{"annotations":[],"doc":null,"fields":[{"default":null,"name":"name","type":{"kind":"primitive","name":"str"}},{"default":null,"name":"shares","type":{"kind":"primitive","name":"i64"}},{"default":null,"name":"price","type":{"kind":"primitive","name":"f64"}}],"generics":[],"invariants":[],"kind":"struct","name":"curriculum.stock_record.StockRecord","public":true},{"annotations":[],"doc":null,"generics":[],"kind":"enum","name":"curriculum.stock_record.StockRecordError","public":true,"variants":[{"fields":[],"name":"EmptyName","symbol":"curriculum.stock_record.StockRecordError.EmptyName"},{"fields":[],"name":"NegativeShares","symbol":"curriculum.stock_record.StockRecordError.NegativeShares"},{"fields":[],"name":"NonFinitePrice","symbol":"curriculum.stock_record.StockRecordError.NonFinitePrice"},{"fields":[],"name":"NegativePrice","symbol":"curriculum.stock_record.StockRecordError.NegativePrice"},{"fields":[],"name":"ValuationOverflow","symbol":"curriculum.stock_record.StockRecordError.ValuationOverflow"}]},{"annotations":[],"body":null,"callable_kind":"sync","contract":{"clauses":[{"clause_id":1,"expression":{"kind":"comparison_chain","operands":[{"base":{"kind":"parameter_ref","reference":{"kind":"parameter","symbol":"curriculum.stock_record.record"},"symbol":"curriculum.stock_record.record","type":{"args":[],"kind":"named","name":"curriculum.stock_record.StockRecord"}},"kind":"field","name":"shares","reference":null,"type":{"kind":"primitive","name":"i64"}},{"kind":"literal","reference":null,"type":{"kind":"primitive","name":"i64"},"value":{"kind":"integer","value":"0"}}],"operators":["greater_equal"],"reference":null,"type":{"kind":"primitive","name":"bool"}},"guard":null,"kind":"requires"},{"clause_id":2,"expression":{"kind":"comparison_chain","operands":[{"base":{"kind":"parameter_ref","reference":{"kind":"parameter","symbol":"curriculum.stock_record.record"},"symbol":"curriculum.stock_record.record","type":{"args":[],"kind":"named","name":"curriculum.stock_record.StockRecord"}},"kind":"field","name":"price","reference":null,"type":{"kind":"primitive","name":"f64"}},{"kind":"literal","reference":null,"type":{"kind":"primitive","name":"f64"},"value":{"bits":"0000000000000000","kind":"f64"}}],"operators":["greater_equal"],"reference":null,"type":{"kind":"primitive","name":"bool"}},"guard":null,"kind":"requires"},{"clause_id":3,"expression":{"kind":"comparison_chain","operands":[{"kind":"literal","reference":null,"type":{"kind":"primitive","name":"f64"},"value":{"bits":"0000000000000000","kind":"f64"}},{"kind":"binding_ref","reference":{"kind":"binding","symbol":"curriculum.stock_record.value"},"symbol":"curriculum.stock_record.value","type":{"kind":"primitive","name":"f64"}},{"kind":"constant_ref","reference":{"kind":"constant","symbol":"curriculum.stock_record.MAX_F64"},"symbol":"curriculum.stock_record.MAX_F64","type":{"kind":"primitive","name":"f64"}}],"operators":["less_equal","less_equal"],"reference":null,"type":{"kind":"primitive","name":"bool"}},"guard":{"pattern":{"arguments":[{"kind":"binding","name":"value","symbol":"curriculum.stock_record.value","type":{"kind":"primitive","name":"f64"}}],"kind":"result_ok","symbol":"Result.Ok","type":{"error":{"args":[],"kind":"named","name":"curriculum.stock_record.StockRecordError"},"kind":"result","ok":{"kind":"primitive","name":"f64"}}},"scrutinee":{"kind":"result_ref","reference":null,"type":{"error":{"args":[],"kind":"named","name":"curriculum.stock_record.StockRecordError"},"kind":"result","ok":{"kind":"primitive","name":"f64"}}}},"kind":"ensures"},{"clause_id":4,"guard":null,"kind":"error","priority":null,"variant":"curriculum.stock_record.StockRecordError.ValuationOverflow","when":null}],"effects":[]},"doc":{"text":"Computes the value of a validated stock record: the share count converted\nto the nearest binary64 value, multiplied by the price with binary64\nround-to-nearest, ties-to-even. The name does not affect the value.\nValuationOverflow is returned when the product is not finite."},"generics":[],"kind":"function","name":"curriculum.stock_record.value_record","parameters":[{"default":null,"kind":"positional","name":"record","type":{"args":[],"kind":"named","name":"curriculum.stock_record.StockRecord"}}],"public":true,"return_type":{"error":{"args":[],"kind":"named","name":"curriculum.stock_record.StockRecordError"},"kind":"result","ok":{"kind":"primitive","name":"f64"}}},{"annotations":[],"body":null,"callable_kind":"sync","contract":{"clauses":[{"clause_id":1,"expression":{"kind":"comparison_chain","operands":[{"kind":"literal","reference":null,"type":{"kind":"primitive","name":"f64"},"value":{"bits":"0000000000000000","kind":"f64"}},{"